{
  "schemaVersion": 1,
  "contentSchemaVersion": 3,
  "contentVersion": "0.6.1-dev.1",
  "locale": "fa-IR",
  "policy": {
    "finalVoice": "human-reviewed",
    "ttsFallback": "offline-device-only",
    "requiredStatusForPublish": "approved"
  },
  "assets": [
    {"id":"task.shape_aa.prompt","category":"letter_or_sound","recordingText":"آ","pronunciationIntent":"pending_educator_review","requiredForPublication":false,"fallback":"visible_text","status":"needs_educator_script","contentRefs":[{"type":"task","lessonId":"visual_shapes_01","taskId":"shape_aa"}],"masterAssetKey":null,"deliveryAssetKey":null,"sha256":null},
    {"id":"task.sound_be.prompt","category":"letter_or_sound","recordingText":"ب","pronunciationIntent":"pending_educator_review","requiredForPublication":true,"fallback":"written_hint","status":"needs_educator_script","contentRefs":[{"type":"task","lessonId":"visual_shapes_01","taskId":"sound_be"}],"masterAssetKey":null,"deliveryAssetKey":null,"sha256":null},
    {"id":"task.shape_mim.prompt","category":"letter_or_sound","recordingText":"م","pronunciationIntent":"pending_educator_review","requiredForPublication":false,"fallback":"visible_text","status":"needs_educator_script","contentRefs":[{"type":"task","lessonId":"visual_shapes_01","taskId":"shape_mim"}],"masterAssetKey":null,"deliveryAssetKey":null,"sha256":null},
    {"id":"task.dots_pe.prompt","category":"letter_or_sound","recordingText":"پ","pronunciationIntent":"pending_educator_review","requiredForPublication":false,"fallback":"visible_text","status":"needs_educator_script","contentRefs":[{"type":"task","lessonId":"dots_02","taskId":"dots_pe"}],"masterAssetKey":null,"deliveryAssetKey":null,"sha256":null},
    {"id":"task.sound_te.prompt","category":"letter_or_sound","recordingText":"ت","pronunciationIntent":"pending_educator_review","requiredForPublication":true,"fallback":"written_hint","status":"needs_educator_script","contentRefs":[{"type":"task","lessonId":"dots_02","taskId":"sound_te"}],"masterAssetKey":null,"deliveryAssetKey":null,"sha256":null},
    {"id":"task.dots_nun.prompt","category":"letter_or_sound","recordingText":"ن","pronunciationIntent":"pending_educator_review","requiredForPublication":false,"fallback":"visible_text","status":"needs_educator_script","contentRefs":[{"type":"task","lessonId":"dots_02","taskId":"dots_nun"}],"masterAssetKey":null,"deliveryAssetKey":null,"sha256":null},
    {"id":"task.word_baba.prompt","category":"word","recordingText":"بابا","pronunciationIntent":"word","requiredForPublication":false,"fallback":"visible_text","status":"needs_recording","contentRefs":[{"type":"task","lessonId":"words_03","taskId":"word_baba"}],"masterAssetKey":null,"deliveryAssetKey":null,"sha256":null},
    {"id":"task.sound_mim.prompt","category":"letter_or_sound","recordingText":"م","pronunciationIntent":"pending_educator_review","requiredForPublication":true,"fallback":"written_hint","status":"needs_educator_script","contentRefs":[{"type":"task","lessonId":"garden_04","taskId":"sound_mim"}],"masterAssetKey":null,"deliveryAssetKey":null,"sha256":null},
    {"id":"task.sound_pe.prompt","category":"letter_or_sound","recordingText":"پ","pronunciationIntent":"pending_educator_review","requiredForPublication":true,"fallback":"written_hint","status":"needs_educator_script","contentRefs":[{"type":"task","lessonId":"garden_04","taskId":"sound_pe"}],"masterAssetKey":null,"deliveryAssetKey":null,"sha256":null},
    {"id":"task.initial_baba.prompt","category":"word","recordingText":"بابا","pronunciationIntent":"pending_educator_review","requiredForPublication":true,"fallback":"written_hint","status":"needs_educator_script","contentRefs":[{"type":"task","lessonId":"edge_sounds_03","taskId":"initial_baba"}],"masterAssetKey":null,"deliveryAssetKey":null,"sha256":null},
    {"id":"task.initial_madar.prompt","category":"word","recordingText":"مادر","pronunciationIntent":"pending_educator_review","requiredForPublication":true,"fallback":"written_hint","status":"needs_educator_script","contentRefs":[{"type":"task","lessonId":"edge_sounds_03","taskId":"initial_madar"}],"masterAssetKey":null,"deliveryAssetKey":null,"sha256":null},
    {"id":"task.final_ab.prompt","category":"word","recordingText":"آب","pronunciationIntent":"pending_educator_review","requiredForPublication":true,"fallback":"written_hint","status":"needs_educator_script","contentRefs":[{"type":"task","lessonId":"edge_sounds_03","taskId":"final_ab"}],"masterAssetKey":null,"deliveryAssetKey":null,"sha256":null},
    {"id":"story.little_seed.page_01","category":"story_narration","recordingText":"آوا گفت: «بیا برای دانه یک خانه بسازیم!» او دانه را آرام در خاک گذاشت.","pronunciationIntent":"natural_story","requiredForPublication":false,"fallback":"visible_text","status":"needs_recording","contentRefs":[{"type":"story_page","storyId":"little_seed","pageIndex":0}],"masterAssetKey":null,"deliveryAssetKey":null,"sha256":null},
    {"id":"story.little_seed.page_02","category":"story_narration","recordingText":"دانه زیر خاک خوابید. آوا برایش کمی آب آورد.","pronunciationIntent":"natural_story","requiredForPublication":false,"fallback":"visible_text","status":"needs_recording","contentRefs":[{"type":"story_page","storyId":"little_seed","pageIndex":1}],"masterAssetKey":null,"deliveryAssetKey":null,"sha256":null},
    {"id":"story.little_seed.page_03","category":"story_narration","recordingText":"هر روز آوا به باغ سر زد. خورشید گرم می‌تابید و دانه آرام رشد می‌کرد.","pronunciationIntent":"natural_story","requiredForPublication":false,"fallback":"visible_text","status":"needs_recording","contentRefs":[{"type":"story_page","storyId":"little_seed","pageIndex":2}],"masterAssetKey":null,"deliveryAssetKey":null,"sha256":null},
    {"id":"story.little_seed.page_04","category":"story_narration","recordingText":"یک صبح، جوانه‌ای کوچک از خاک بیرون آمد. آوا لبخند زد.","pronunciationIntent":"natural_story","requiredForPublication":false,"fallback":"visible_text","status":"needs_recording","contentRefs":[{"type":"story_page","storyId":"little_seed","pageIndex":3}],"masterAssetKey":null,"deliveryAssetKey":null,"sha256":null},
    {"id":"story.little_seed.page_05","category":"story_narration","recordingText":"آوا گفت: «با کمی صبر و مراقبت، چیزهای کوچک هم بزرگ می‌شوند.»","pronunciationIntent":"natural_story","requiredForPublication":false,"fallback":"visible_text","status":"needs_recording","contentRefs":[{"type":"story_page","storyId":"little_seed","pageIndex":4}],"masterAssetKey":null,"deliveryAssetKey":null,"sha256":null},
    {"id":"story.friends_book.page_01","category":"story_narration","recordingText":"آوا یک کتاب تازه پیدا کرد. روی جلدش یک ستاره بود.","pronunciationIntent":"natural_story","requiredForPublication":false,"fallback":"visible_text","status":"needs_recording","contentRefs":[{"type":"story_page","storyId":"friends_book","pageIndex":0}],"masterAssetKey":null,"deliveryAssetKey":null,"sha256":null},
    {"id":"story.friends_book.page_02","category":"story_narration","recordingText":"خرگوش و روباه آمدند. سنجاب هم کنارشان نشست.","pronunciationIntent":"natural_story","requiredForPublication":false,"fallback":"visible_text","status":"needs_recording","contentRefs":[{"type":"story_page","storyId":"friends_book","pageIndex":1}],"masterAssetKey":null,"deliveryAssetKey":null,"sha256":null},
    {"id":"story.friends_book.page_03","category":"story_narration","recordingText":"آوا کتاب را باز کرد. هر دوست یک تصویر تازه در آن پیدا کرد.","pronunciationIntent":"natural_story","requiredForPublication":false,"fallback":"visible_text","status":"needs_recording","contentRefs":[{"type":"story_page","storyId":"friends_book","pageIndex":2}],"masterAssetKey":null,"deliveryAssetKey":null,"sha256":null},
    {"id":"story.friends_book.page_04","category":"story_narration","recordingText":"دوستان گفتند: «خواندن کنار هم چه لذتی دارد!» کتاب دوباره در باغ باز شد.","pronunciationIntent":"natural_story","requiredForPublication":false,"fallback":"visible_text","status":"needs_recording","contentRefs":[{"type":"story_page","storyId":"friends_book","pageIndex":3}],"masterAssetKey":null,"deliveryAssetKey":null,"sha256":null},
    {"id":"feedback.correct","category":"feedback_effect","recordingText":"تأیید پاسخ درست","pronunciationIntent":"non_speech_effect","requiredForPublication":false,"fallback":"silent","status":"needs_recording","contentRefs":[{"type":"system","key":"feedback.correct"}],"masterAssetKey":null,"deliveryAssetKey":null,"sha256":null}
  ]
}
